{"builder":{"name":"agronomy_agent.curated_knowledge_store","packing_order":["policy_role","source_id","source_edition_hash","chunk_index","doc_id"],"version":2},"chunking":{"extractors":[{"max_words":null,"name":"scripts/build_ontario_crop_statistics_context.py","overlap_words":null,"schema_version":1},{"max_words":220,"name":"scripts/ingest_document_sources.py","overlap_words":35,"schema_version":10}],"input_mode":"preextracted_jsonl"},"excluded_source_ids":[],"included_source_ids":["ab_clubroot_canola_mustard_2015","ab_crop_producer_bmp_manual_2004","ab_fall_applied_nitrogen_2013","ab_nutrient_management_planning_guide_2008","ab_phosphorus_fertilizer_crops_2013","ab_potassium_fertilizer_crops_2013","ab_red_lentil_management_2020","ab_stripe_rust_101_2023","ab_sulphur_fertilizer_crops_2013","ab_tame_pasture_range_health_2017","ca_aafc_annual_crop_inventory_specification","ca_aafc_crop_health_indices_specification","ca_aafc_nasdi_specification","ca_aafc_sk_detailed_soil_survey_specification","ca_cansis_soil_landscapes","mb_2023_crop_rotation_context","mb_2026_canola_insect_scouting","mb_2026_crop_disease_scouting","mb_soil_fertility_guide","on_field_crop_production_current"],"max_shard_bytes":25165824,"profiles":[{"base_profile":null,"corpus_paths":["shards/context_only-canada-offline-master-0001.jsonl","shards/requires_live_authority-canada-offline-master-0001.jsonl"],"description":"All 969 admitted Canadian rows as of 2026-08-14 in one cumulative offline profile. Historical, modelled, regional, and benign scouting-method material remains context-only; numeric pest thresholds and other rows requiring current authority remain physically and semantically separated. Retrieval and redistribution do not authorize training.","policy_manifest_path":"profiles/canada-offline-master/runtime_corpus_policy.json","policy_manifest_sha256":"c35d28d19c36761b4040fd40b1bace0f4f69d850ab2b045ef83f357960333907","profile_id":"canada-offline-master","rag_config_path":"profiles/canada-offline-master/rag.yaml","rag_config_sha256":"0a6e561d33c552ade3728ee316ebb6592c7eb0c0b413bdfaca20f027c38c2d1c","source_ids":["ab_clubroot_canola_mustard_2015","ab_crop_producer_bmp_manual_2004","ab_fall_applied_nitrogen_2013","ab_nutrient_management_planning_guide_2008","ab_phosphorus_fertilizer_crops_2013","ab_potassium_fertilizer_crops_2013","ab_red_lentil_management_2020","ab_stripe_rust_101_2023","ab_sulphur_fertilizer_crops_2013","ab_tame_pasture_range_health_2017","ca_aafc_annual_crop_inventory_specification","ca_aafc_crop_health_indices_specification","ca_aafc_nasdi_specification","ca_aafc_sk_detailed_soil_survey_specification","ca_cansis_soil_landscapes","mb_2023_crop_rotation_context","mb_2026_canola_insect_scouting","mb_2026_crop_disease_scouting","mb_soil_fertility_guide","on_field_crop_production_current"],"source_ids_added":["ab_clubroot_canola_mustard_2015","ab_crop_producer_bmp_manual_2004","ab_fall_applied_nitrogen_2013","ab_nutrient_management_planning_guide_2008","ab_phosphorus_fertilizer_crops_2013","ab_potassium_fertilizer_crops_2013","ab_red_lentil_management_2020","ab_stripe_rust_101_2023","ab_sulphur_fertilizer_crops_2013","ab_tame_pasture_range_health_2017","ca_aafc_annual_crop_inventory_specification","ca_aafc_crop_health_indices_specification","ca_aafc_nasdi_specification","ca_aafc_sk_detailed_soil_survey_specification","ca_cansis_soil_landscapes","mb_2023_crop_rotation_context","mb_2026_canola_insect_scouting","mb_2026_crop_disease_scouting","mb_soil_fertility_guide","on_field_crop_production_current"]}],"receipts":{"ingest_summary_path":"receipts/ingest_summary.json","ingest_summary_sha256":"3aee3d80baeb99c4c2555a0205b91881ef04f4f3fb47934555a8e28f2810344f","source_coverage_path":"receipts/source_coverage.json","source_coverage_sha256":"c7353a628b6b2fb34eec9a90901ccc40eb2af5c8f2bc2764af69eb0de8400622"},"release_date":"2026-08-14","schema_version":"open_agronomy_agent.curated_knowledge_store.v1","shards":[{"bytes":5518525,"id":"context_only-canada-offline-master-0001","jurisdictions":["Alberta","Canada","Manitoba","Ontario","Saskatchewan"],"languages":["en-CA","fr-CA"],"path":"shards/context_only-canada-offline-master-0001.jsonl","policy_role":"context_only","row_retrieval_policy_counts":{"context_only":955},"rows":955,"sha256":"373146ad55a26503292f8e8f252cf52b830774302ecf54c0b4511c3093347810","source_ids":["ab_clubroot_canola_mustard_2015","ab_crop_producer_bmp_manual_2004","ab_fall_applied_nitrogen_2013","ab_nutrient_management_planning_guide_2008","ab_phosphorus_fertilizer_crops_2013","ab_potassium_fertilizer_crops_2013","ab_red_lentil_management_2020","ab_stripe_rust_101_2023","ab_sulphur_fertilizer_crops_2013","ab_tame_pasture_range_health_2017","ca_aafc_annual_crop_inventory_specification","ca_aafc_crop_health_indices_specification","ca_aafc_nasdi_specification","ca_aafc_sk_detailed_soil_survey_specification","ca_cansis_soil_landscapes","mb_2023_crop_rotation_context","mb_2026_canola_insect_scouting","mb_2026_crop_disease_scouting","mb_soil_fertility_guide","on_field_crop_production_current"],"unique_content_fingerprints":955,"unique_doc_ids":955},{"bytes":85319,"id":"requires_live_authority-canada-offline-master-0001","jurisdictions":["Alberta","Manitoba"],"languages":["en-CA"],"path":"shards/requires_live_authority-canada-offline-master-0001.jsonl","policy_role":"requires_live_authority","row_retrieval_policy_counts":{"requires_live_authority":14},"rows":14,"sha256":"5379329ecefe50d5b7d32cb5ff79a993277cab1fdb1e9351898f8c0717fdc05c","source_ids":["ab_crop_producer_bmp_manual_2004","ab_red_lentil_management_2020","ab_sulphur_fertilizer_crops_2013","mb_2026_canola_insect_scouting","mb_soil_fertility_guide"],"unique_content_fingerprints":14,"unique_doc_ids":14}],"source_registry":{"path_hint":"data/manifests/canada_agronomy_sources.json","schema_version":"open_agronomy_agent.canada_agronomy_sources.v1","sha256":"f539619f941d10e1650123d274291beffaf29b4016ae5d2d552671d66cdd8ee2"},"store_id":"curated-canada-2026-08-14","totals":{"bytes":5603844,"rows":969,"shards":2,"unique_content_fingerprints":969,"unique_doc_ids":969},"training_authorization":{"granted":false,"statement":"No source in this store is admitted for training; retrieval admission does not grant a training or fine-tuning licence."}}
